{
  "$schema": "https://json-schema.org/draft/2020-12/schema",
  "$id": "https://github.com/Ecro/harness-bench/blob/main/results/schema.json",
  "title": "harness-bench result",
  "description": "One measurement of one model on one experiment. Fields that could not be measured are null, never zero -- an unmeasured trait and a measured zero are different claims.",
  "type": "object",
  "required": ["model", "experiment", "traits", "created_at", "total_calls", "exploratory"],
  "properties": {
    "model": {"type": "string", "description": "adapter name, e.g. claude"},
    "model_version": {"type": ["string", "null"], "description": "the RESOLVED model id reported by the CLI, not the alias requested. Null means the CLI did not report one, which is a degradation."},
    "experiment": {"type": "string", "description": "<experiment>/<task>"},

    "bench_version": {"type": ["string", "null"]},
    "bench_commit": {"type": ["string", "null"], "description": "short git sha; a -dirty suffix means the run is not reproducible from any published commit"},
    "task_digest": {"type": ["string", "null"], "description": "sha256 over the task's SPEC, frozen suite and reference. Two results are comparable only if this matches."},
    "prereg_sha256": {"type": ["string", "null"]},

    "exploratory": {"type": "boolean", "description": "true when predictions were not frozen before the run. Never removed downstream."},
    "tools_blockable": {"type": ["boolean", "null"], "description": "false marks a known confound: this adapter cannot disable tools"},
    "superseded_by": {"type": ["string", "null"], "description": "set when a later run replaces this one. The row is kept, not deleted."},
    "note": {"type": ["string", "null"]},

    "total_calls": {"type": "integer", "minimum": 0},
    "total_cost_usd": {"type": ["number", "null"], "description": "null means unknown, NOT zero"},
    "total_tokens": {"type": ["integer", "null"]},
    "created_at": {"type": "string", "format": "date-time"},

    "traits": {
      "type": "object",
      "description": "measured traits, keyed by trait name",
      "additionalProperties": {
        "type": "object",
        "required": ["key", "value"],
        "properties": {
          "key": {"type": "string"},
          "value": {"type": ["number", "string", "boolean", "null"],
                    "description": "null = not measurable under these conditions"},
          "unit": {"type": "string"},
          "note": {"type": "string", "description": "carries the underlying series, split verdicts, and why a value is null"},
          "degraded": {"type": "boolean", "description": "the measurement itself was incomplete"}
        }
      }
    }
  }
}
