{
  "model": "claude",
  "model_version": "claude-opus-5",
  "experiment": "review_convergence/retry_policy",
  "traits": {
    "spread": {
      "key": "spread",
      "value": null,
      "unit": "",
      "note": "n=0 []",
      "degraded": true
    },
    "loop_decay": {
      "key": "loop_decay",
      "value": -1.25,
      "unit": "",
      "note": "[13, 9, 9, 9, 8]",
      "degraded": false
    },
    "churn_dries": {
      "key": "churn_dries",
      "value": false,
      "unit": "",
      "note": "갈림 1:2 · ratios=[0.611, 0.732, 0.72]",
      "degraded": false
    },
    "churn_ratio": {
      "key": "churn_ratio",
      "value": 0.688,
      "unit": "후/전",
      "note": "루프별 [0.611, 0.732, 0.72]",
      "degraded": false
    },
    "rejection_rate": {
      "key": "rejection_rate",
      "value": 0.209,
      "unit": "",
      "note": "32/153",
      "degraded": false
    },
    "malformed_rate": {
      "key": "malformed_rate",
      "value": 0.0,
      "unit": "",
      "note": "",
      "degraded": false
    },
    "ac_held": {
      "key": "ac_held",
      "value": true,
      "unit": "",
      "note": "",
      "degraded": false
    },
    "loc_direction": {
      "key": "loc_direction",
      "value": 1.258,
      "unit": "×",
      "note": "",
      "degraded": false
    },
    "tools_blockable": {
      "key": "tools_blockable",
      "value": true,
      "unit": "",
      "note": "",
      "degraded": false
    },
    "finds_per_call": {
      "key": "finds_per_call",
      "value": null,
      "unit": "",
      "note": "tier-2 전용 (판정된 결함 집합 필요)",
      "degraded": true
    },
    "verbosity_shift": {
      "key": "verbosity_shift",
      "value": null,
      "unit": "",
      "note": "tier-2 전용 (리포 접근 대비 필요)",
      "degraded": true
    }
  },
  "exploratory": true,
  "prereg_sha256": null,
  "tools_blockable": true,
  "total_calls": 30,
  "total_cost_usd": 15.7399,
  "total_tokens": 462800,
  "created_at": "2026-08-21T07:55:14+00:00"
}