{
  "model": "codex",
  "model_version": "gpt-5.6-sol",
  "experiment": "review_convergence/retry_policy",
  "traits": {
    "spread": {
      "key": "spread",
      "value": null,
      "unit": "",
      "note": "n=0 []",
      "degraded": true
    },
    "loop_decay": {
      "key": "loop_decay",
      "value": -0.25,
      "unit": "",
      "note": "[4, 4, 4, 3, 3]",
      "degraded": false
    },
    "churn_dries": {
      "key": "churn_dries",
      "value": null,
      "unit": "",
      "note": "루프 2/3 -- 판정 불가 (D-001)",
      "degraded": true
    },
    "churn_ratio": {
      "key": "churn_ratio",
      "value": 0.394,
      "unit": "후/전",
      "note": "루프별 [None, 0.476, 0.313]",
      "degraded": false
    },
    "rejection_rate": {
      "key": "rejection_rate",
      "value": 0.273,
      "unit": "",
      "note": "9/33",
      "degraded": false
    },
    "malformed_rate": {
      "key": "malformed_rate",
      "value": 0.0,
      "unit": "",
      "note": "",
      "degraded": false
    },
    "ac_held": {
      "key": "ac_held",
      "value": true,
      "unit": "",
      "note": "",
      "degraded": false
    },
    "loc_direction": {
      "key": "loc_direction",
      "value": 0.906,
      "unit": "×",
      "note": "",
      "degraded": false
    },
    "tools_blockable": {
      "key": "tools_blockable",
      "value": false,
      "unit": "",
      "note": "",
      "degraded": false
    },
    "finds_per_call": {
      "key": "finds_per_call",
      "value": null,
      "unit": "",
      "note": "tier-2 전용 (판정된 결함 집합 필요)",
      "degraded": true
    },
    "verbosity_shift": {
      "key": "verbosity_shift",
      "value": null,
      "unit": "",
      "note": "tier-2 전용 (리포 접근 대비 필요)",
      "degraded": true
    }
  },
  "exploratory": true,
  "prereg_sha256": null,
  "tools_blockable": false,
  "total_calls": 24,
  "total_cost_usd": null,
  "total_tokens": 573210,
  "created_at": "2026-08-21T07:14:30+00:00"
}