{
  "model": "claude",
  "model_version": "claude-opus-5",
  "experiment": "review_convergence/retry_policy",
  "traits": {
    "spread": {
      "key": "spread",
      "value": 2,
      "unit": "",
      "note": "n=5 [13, 13, 12, 14, 12]",
      "degraded": false
    },
    "loop_decay": {
      "key": "loop_decay",
      "value": -0.5,
      "unit": "",
      "note": "[11, 10, 10, 8, 9]",
      "degraded": false
    },
    "churn_dries": {
      "key": "churn_dries",
      "value": true,
      "unit": "",
      "note": "[70, 58, 27, 46, 33]",
      "degraded": false
    },
    "rejection_rate": {
      "key": "rejection_rate",
      "value": 0.458,
      "unit": "",
      "note": "22/48",
      "degraded": false
    },
    "malformed_rate": {
      "key": "malformed_rate",
      "value": 0.0,
      "unit": "",
      "note": "",
      "degraded": false
    },
    "ac_held": {
      "key": "ac_held",
      "value": true,
      "unit": "",
      "note": "",
      "degraded": false
    },
    "loc_direction": {
      "key": "loc_direction",
      "value": 1.391,
      "unit": "×",
      "note": "",
      "degraded": false
    },
    "tools_blockable": {
      "key": "tools_blockable",
      "value": true,
      "unit": "",
      "note": "",
      "degraded": false
    },
    "finds_per_call": {
      "key": "finds_per_call",
      "value": null,
      "unit": "",
      "note": "tier-2 전용 (판정된 결함 집합 필요)",
      "degraded": true
    },
    "verbosity_shift": {
      "key": "verbosity_shift",
      "value": null,
      "unit": "",
      "note": "tier-2 전용 (리포 접근 대비 필요)",
      "degraded": true
    }
  },
  "exploratory": true,
  "prereg_sha256": null,
  "tools_blockable": true,
  "total_calls": 15,
  "total_cost_usd": 6.6018,
  "total_tokens": 196315,
  "created_at": "2026-08-21T05:46:26+00:00",
  "superseded_by": "3-loop run",
  "note": "Single loop (n=1). churn_dries=True came from this run's ratio 0.617; the three-loop re-measurement gave 0.611 / 0.732 / 0.720 -- clustered around the 0.7 threshold, verdict False (split 1:2). Kept because the distribution is the finding: one loop lands on either side of the boundary by chance."
}